            RelationshipsI posted this inR/Relationship_advice, but it got buried and I got only three replies so looking for advice here.TLDR at Bottom This will be a long post.I'm  finally at a point where I can't stand this anymore. I've been in love  with this woman for a very long time, maybe a couple of years at this  point and I'm not sure if I should just kill it or attempt to make  something with her.I met my  ex-wife, her sister, when I was 23-years-old and the relationship  developed very quickly and by 26 I had my son and daugther and had  gotten married. However, within months of being married my ex-wife had  an affair, but worse than that the man she cheated with had gotten her  into Heroin. After confronting her on this she said she was going to get  help, but instead she left in the night. I haven't heard from her in 4  years and last I've heard she's still with that guy and are homeless in  Las Vegas. Not sure how true that is, but being focused on holding it  together for the kids, I really don't have the time to chase her down,  nor do I want to after what she pulled.I  ended up getting a divorce in absentia. I did however maintain a very  positive relationship with my inlaws after the fact. Every other weekend  my kids stay over with their grandparents on that side and they pretty  much treat me like a son still, I still go to parties at Christmas and  am reasonably liked by the family. Nobody talks about my ex anymore  mainly to not worry my kids. My oldest, my son is very hurt by his  mother leaving. He's 9 now and I've had to get therapy for him after he  told me he hoped his mother was dead. She had been getting verbally  abusive toward the end which was when he was around 5 or 6Anyhow,  in the year following my ex leaving, her sister and my her boyfriend  had started coming around a lot to see the kids. They knew I worked a  lot and would babysit and call it practice as they wanted to have  children of their own. My kids love them and were spoiled by them, which  I didn't mind because we all needed a little positivity. They got  married and were very in love. However, her husband was killed in a  workplace accident shortly after the birth of their daughter.It  has been extremely rough and painful for everyone involved as one can  imagine. I followed my Sil's example and began to take her daughter to  give her time to herself if things got too hard to deal with or she  needed alone time. She's been in grief counciling for a few years but  she still wears her ring and has told me she can't ever imagine dating  again. I talk to her about him frequently and she's gotten to a better  place but she's still very much in love with him, I can't imagine that  sort of pain.Over the last two  years we've been a more constant figure in each others lives. My kids  love their aunt and I have her over for dinner a couple times a week. My  daughter and her daughter have become close and love being around each  other so they have sleepovers. I've moved on from my ex by this but the  idea of dating possibly someone dangerous as their mother has kept me  out of the dating scene.I don't  know when it happened, but slowly I began to get soft on my SIL. She's a  great mom for what she's had happen to her. She's one of the sweetest  people I know and her sense of humor always leaves me laughing and  happy. Then I started realizing that I'm physically attracted to her.  I've always felt kind guilty about it because her late husband was a  good friend and since she's obviously is still grieving, so I've kept it  to myself.Since Covid started  we've been together a bit more because social distancing has had us lose  contact with most other people. Nothing romantic has ever been  discussed and I try not to flirt, but last week it was very late and  after the kids went to bed I made us a few drinks, not enough to get  drunk but she decided she'd rather spend the night, so I took my couch. I  woke up to breakfast this morning and the four of us felt like the sort  of family I've always wanted. She even kissed my forehead which is not  something she normally does. I still didn't say anything, but after she  left I found my son quietly playing with his toys in his room. He looked  upset so I asked him if he was alright.He  tells me point blank in the way only a kid can that he wishes Sil was  his mother. I sat down with him and asked him why he thought that way  and he gave a whole bunch of reasons her being nice to him, that she  never yells about anything. He likes seeing her at his grandparents and  she draws pictures with him, which I didn't know they did. By the end of  it my heart that is already melting for this woman even more wound up.When  visiting dropping them off with their grandparents, I tried to breach  the subject with her folks to kinda feel around how people would see. I  made a joke about she and I acting like a married couple sometimes and  they didn't laugh and were kind of stand offish, friendly but either  they know something or they disapprove.It's  getting too hard for me to ignore or pretend it's not getting to me.  I'm in love with her. Either I've got to kill it and find some way not  to think of her, or I have to find some sort of way to navigate through  this situation and tell her everything. If anybody out there has any  insight on how to approach a widow, especially one who was married to a  friend, with this sort of intention I could really use your help.TLDR-  Sil and I became close after my divorce to her sister and death of her  husband. She's great with my kids. I'm in love and don't know how to  proceed.100 commentssharesavehidereport99% Upvoted
kmiu1k,3.4kPosted by10 months agoArchivedMy dad (74) trashed my apartment. I want to kick him out, but my wife says she thinks it's "not the right thing to do".
              
            Non-RomanticRecently my wife and I went on a vacation for two weeks. We're lucky that in our country, COVID has been kept at bay, so travelling within the country is pretty easy.My dad lives in our apartment.  He doesn't pay rent. While we were away, he continued living there. Upon our return, the place had pretty much been trashed.There were fast food wrappers all over the floor, in the living room and bedrooms. Dirty shirts (several of them mine) being washed in the kitchen sink. Toilets in the bathrooms clogged up. One of the windows was left open during a rainstorm, letting rainwater in. Open condiment jars and cold cuts left out. Moldy food on the stove. A dozen half-finished coffees everywhere. Laundry just thrown on the floor in the living room. Appliances that were working perfectly fine before we left broken.He is actually in good shape mentally, but he's just always been a slob.This isn't the first time he's abused our space. He refuses to live by my rules, even though the house is in my name. A while back, he allowed his friends to use our home as a meeting place. When one of them started trying to recruit people for a MLM, I said that the party was over and that I wanted everyone off my property.  I called the cops and unfortunately in the heat of the moment, I lost my temper in front of them by saying if f the cops didn't remove them from my property, I would do so with force.  My dad then got upset with me because I had "disrespected" his friends and made him look bad.I talked to my wife about it, and while she acknowledges that my dad is a slob and a hoarder, she doesn't want to kick him out because he gave us money towards the home for our wedding.  She said that if something happened to him it would weigh on her conscience if she sided with me in asking him to leave.TL;DR - Dad trashed my apartment and I want him to leave.  Wife said she feels bad about asking him to leave because dad gave us some money to buy the house and because of the risk of something happening to him.424 commentssharesavehidereport98% Upvoted
nyc49t,3.5kPosted by4 months agoWoman (20sF) at gym is flirting and making my( 27F) BF (26) uncomfortable. How do we get her to stop?
              
            RelationshipsSorry, this post was removed by Reddit's spam filters.Reddit's automated bots frequently filter posts it thinks might be spam.564 commentssharesavehidereport94% Upvoted
nti1h4,3.3kPosted by4 months ago3846UPDATE: LDR boyfriend (M23) cheated on me (F20) after 3 years together with another girl (F<20) - do I tell the other girl?
              
            UpdatesUpdate to this post. TL;DR from that post is: Boyfriend of 3 years cheating with someone else, they've been together for 9 months. I broke up with him. She doesn't know I exist. She sounds severely depressed, suicidal and self-harms plus issues with drugs and alcohol. He asked me not to tell her as she would "kill herself". Unsure if I should - moral conundrum. Help.I told her. Sent her a long message from my own instagram account (no burners or anything). Lots of empathy and kindness. Told her I was on her side. She asked for proof, sent that through.Ex texted me 5 mins later with "You did it hey?" (I'd blocked him on all social medias except for phone number). Then he weirdly thanked me; said it was better for his head and mental health now. I did him a favour. Baffled me a little. Sent him a couple harsh text messages explaining it wasn't for him, but for her. She deserved the truth. He apologised again, lol, and then I sent him a final message and blocked.Girl seemed devestated, not angry at me thankfully as I was scared of her spinning it against me which I don't think I could've handled in my... delicate state lol. Told her I was there for her. Had a little chat, but haven't talked to her since (12hrs ago). Not expecting to continue talking. Dunno if she properly broke up with him, or taking a break since they still follow eachother but she changed her profile pic so it's no longer matching and relationship date from her bio is gone. None of my business what happens next, I just hope she's okay and takes the next steps which are healthy for her. No idea if she's suicidal/self-harming - I had that in the long message sent to her that 'he told me you were vulnerable and suffering from depression so I debated sending this msg but I think you deserve the truth'. Inevitably, I think it's better for her to know rather than confide in a liar who is abusing her vulnerability.Thank you to everyone who replied on the previous post, definitely helped to see other strangers agreeing with sending a message and informing her. If anyone ends up in a similar situ, I hope you never do, but send the message to the unknowing affair partner. It'll relieve your conscience I think, even though you're not in the wrong. That sounds weird, but trust me I know I was the one cheated on and that she was the 'other woman' but it still felt good to tell her what the real truth was, rather than him spinning it against me or never telling her. It's kinda like a final kaboom in my exes face, making sure he can't just go crawling to his other girlfriend now that I broke up with him, and she knew the full truth and can decide what to do next (break up or stay together).I feel relieved. I have finally stopped feeling nauseated and throwing up. Had my first good nights sleep since I found out. Nothing but bad feelings for the ex. I dunno if it's hate, that's a strong word. I resent what he put me through, and the waste of time, and the lies for such a long time. He's made me unsure of myself and everything he told me, but I have enough self-respect to break-up with him. Miss what I thought we had I think? I dunno. It was all lies I guess. I want him to figure himself out, mature and eventually settle down (not with me). Holding all my resentment against the cheating ex, not affair partner.The hurt is setting in now. Last couple days it was anger. Now it's just pain lol. Now, can anyone offer post-discovering-your-long-term-partners-been-cheating-on-you-for-almost-a-year advice? I'm not used to not being busy and am having too many thoughts, I just finished final exams so have been studying for months and been busy and now its... nothing. Glad I found out after exams, but not sure what to do now. Advice appreciated.TL;DR: Told the unknowing affair partner via Instagram DMs on my personal account. Long, empathetic message telling her I'm on her side + proof when she asked for it. Ex texted me "you did it hey?" and then thanked me. Blocked his number. She seems sad, unsure if 100% broken up but pfps and date in bio changed. I don't care, not my business. Hope for the best for her. Now I need advice on how to heal, if anyone has any. Thanks.118 commentssharesavehidereport97% Upvoted
ih4r1x,3.1kPosted by1 year agoArchived2My (32F) Fiance (34M) walked in on my therapy session, overheard, and is perhaps upset
              
            Relationships**EDIT: I shared an update (positive) in comments section, as 48 hours must elapse in order make a separate update post. Thank you all for the thoughtful and compassionate responses.Backstory: I (32F) have been with fiance (34M) for several years. I've been in therapy since 21. I am admittedly a "work in progress" as I always will be, though I would like to think that I try as hard as I can and have developed some strategies to utilizes when things seem to be spiraling. This has allowed me to have a stable home life, relationship turned engagement, and I've always been able to hold down a decent job.My fiance does not have mental health issues, but often acknowledges that he wishes he was in therapy to deal with how he handles frustration and crisis situations. He has insurance, but can't seem to find the time to make an appointment for himself. He respects and is proud of me for going to therapy myself and when I become extremely anxious about situations (even about things related to our communication) he encourages me to talk about it (but not in a diminishing or gaslighting way).Prior to COVID, I (like most others) went to see a therapist in-person. Now it happens virtually, and I actually find it more effective for some reason. When I talk about really difficult subjects I'm processing, I tend to raise my voice and cry. Fiance and I live in a small apartment and it has happened so far that he has been out of the house during my sessions, so this issue hasn't yet come up.Today, fiance unexpectedly came home for lunch in the middle of a session. I knew that he'd come back at some point but wasn't sure exactly when. While on the phone w therapist, I was pretty viscerally upset and going off about some deeply-rooted, abuse related issues about family and ex. Fiance got home and walked towards my room to say hi and opened the door. He walked on me me speaking about something in abstract, and quickly left the room. He went into the living room and put on a podcast, maybe in an effort for me not to be worried that he was eavesdropping. So I figured he wasnt listening and continued to vent (about past resentment). Then But then I heard some shuffling outside my door in the hallway and when he coughed accidentally, it made clear how close he was. It was a super awkward situation all around and I'm not sure how I should have handled it.He then left the apartment and I'm not sure if I upset him. I'm also wondering if I messed up by not warning him in the morning that I would be in an appointment later. I had a million other work related things to do today on the forefront of my mind. I texted him that I'm sorry I missed him, and no response for an hour.  If I did in fact upset him, not sure how/if to apologize, so any advice would be appreciated.tldr; fiance came home unexpectedly, most likely overheard me venting about serious issues unrelated to him, left abruptly and I'm afraid I upset him183 commentssharesavehidereport94% Upvoted
hzkdbw,3.1kPosted by1 year agoArchivedI [24F] don’t want to furnish a guest room for my mother [64F] in my new home.
              
            Non-RomanticTL;DR Mom is very excited that I’m going to have a spare bedroom. I’m flooded with apprehension. I don’t know if my feelings are justified or not. ——————————————————————-My partner [24M] and I are moving into a 1300 sq ft 2/2 townhome this week. Our current apartment is a snug 350 sq ft 1/1.I’ve been working from home out of our bedroom since mid-March. This hasn’t done wonders for my mental wellbeing. Moving into a bigger place has been a light at the end of the tunnel these last few months.I’m particularly happy about having a second bedroom, as my partner agreed that I should turn it into my home office. (I expect to continue working from home for quite a while longer.)In my excitement, I told both my parents all about the new place as soon as our application was approved.(Context on my parents: My parents are divorced. They live in my hometown, roughly an eight hour drive away.)When I mentioned the second bedroom in the townhome to my mom, she immediately began talking about staying in “her guest room”. I told her that I was going to turn the spare room into a home office, but she just replied “with a sleeper sofa!” She then began talking excitedly about how she’d be able to drive up and visit “often”. I didn’t know what to say, but something in my gut turned.My mom works at an airport in a COVID hotspot. I have asthma that gets worse when I get sick, so I can’t take any chances with COVID. Knowing this, my mom has been trying for months to push me to visit her, and she’s been asking repeatedly if she can come visit me. (She has outright refused to quarantine herself for two weeks prior to seeing me.)I put my foot down and told her that any travel was out of the question, and she kind of accepted that. She still complains about it every time we talk though, and she still asks even though she knows the answer is no. Recently, she asked me if I needed her to come visit to help me move. After that didn’t work, she asked if she could come visit in August to “see the new place” and celebrate her birthday. I felt guilty about saying no, so I gave a very noncommital response.At this point, I’m not even sure if I’d want to see her even if she did quarantine for two weeks beforehand. My mom gets way too pushy when she doesn’t get her way, and it makes me very uncomfortable. The problem is, she’s also extremely giving and generous, so it makes me feel guilty denying her requests.She’s constantly offering to give me money I don’t need, and she tries to lend a helping hand in every situation without being asked. She has offered to pay for graduate school for me and pay for my living expenses, because she wants me back in school. (We had that arrangement when I was in undergrad, but the money was never as reliable as she said it would be. Having independence and a stable job has been a godsend. I’m never relying on her financially again.)I almost think she’s generous so that she has leverage to push people around with. I don’t think she’s doing it in a conscious, malicious way, though. I think she does it because having control and feeling like a good person makes her happy.In the past, when I’ve told her “no”, she has gone straight to guilting me. On one occasion, she wanted to stay the night with my partner and I in our tiny little apartment. I told her that my partner’s family, who live in town, would be more than happy to have her as a guest. In fact, they had already prepared the guest room for her. She cried and said that I “didn’t want her”, and she basically had a meltdown. I told her we didn’t have room or an air mattress, so she’d have to sleep on the floor. I told her that this was unacceptable, and that I would not allow my mother to sleep on grubby carpet. She then threatened to drive all the way back home overnight, after having driven all the way from home that day. When we didn’t back down, she went through with the threat. I couldn’t sleep that night out of fear, worrying about her crashing the car from sleep deprivation.My partner has held my mother in poor regard ever since that incident. He really doesn’t want her to stay with us in the future. I could blame things on him and tell her that he’s the reason why she can’t stay with us, but that’s not fair to him. Plus, she might try to retaliate in some way, and I don’t want that.***Actual TL;DR, after writing out my feelings: How do I tell my mother that my home office isn’t her guest bedroom? How do I tell her that she can’t come visit me in August?I don’t even want to have her sleeping on an air mattress in my home office, because I’m uncomfortable leaving her alone with my belongings. She has gone through my things at least once in the past.She keeps texting me, asking me how moving is going. Every time I see her texts, I feel a mix of discomfort and guilt. It makes me want to throw my phone away.Reddit, please help? —————————————————————Edit: Wow, I’ve never had a post receive this much attention before. It’s interesting how many comments I’ve received guilting me for not wanting my mom to visit right now. The majority of comments were really constructive and supportive, but a noticeable minority basically told me “you’ll miss your mom when she dies” and “she’s divorced and lonely and loves you, you ungrateful child”. Here I go JADE-ing at those comments. (Good term, thank y’all for teaching it to me!)I’m uncomfortable around my mom because she’s completely disregarding COVID, and I am in a high-risk group. My dad’s health isn’t great either and I worry about him, as they live near one another and still see each other.I’m uncomfortable around my mom because she doesn’t care for LGBT people, and both my partner and I are bisexual.I’m uncomfortable around my mom because I went on a friendly mall date with a (gasp) non-white boy once in my teens, and she told me she “didn’t want a nappy-haired grandchild”.I’m uncomfortable around my mom because she has had a history of psychosis. When she’s under stress, she can act in ways that don’t always make sense. When I was little, it was worse, and she scared me a few times.I’m uncomfortable around my mom because she’s not very good with money, and she has asked me for money before. Even though she makes thousands more a month than I do. (She wanted to buy a big-ticket item, and didn’t want to save for a month to buy it.)I’m uncomfortable around my mom because she handled divorcing my dad really poorly, and didn’t seem to care for how I felt at all. I was twelve. She discouraged me from talking to my dad, took me away traveling on weekends I was supposed to see him, and she tried to get a restraining order on him. She had no reason to do that. She actually took me with her to court that day, and it was all I could do not to run over and hug my dad. I think I did hug him, actually, and he had to tell me it wasn’t allowed. He and I were so close before the divorce, and we’re still trying to fix our relationship.I’m uncomfortable around my mom because she didn’t step in or do anything when I was in an emotionally abusive relationship with an adult male as a teenage girl. He was 22, and I was 16, and she let him sleep in her house. Of course I thought it was a good idea at first, but I was in too deep very quickly. He was coercive, mean, and selfish. I needed my mom to step in and act like a parent, maybe by kicking him out and forbidding me from seeing him. Instead, she enabled the whole thing. I had to “break up” with this man, and that was only after he tried to coerce me into marrying him.I’m uncomfortable with my mom because she always wants me to approve of her bad decisions, and gets angry when I don’t.I’m uncomfortable around my mom because when she saw that I was anxious as a little kid, she forced pills on me and took me to a psych ward (completely unprompted, I was discharged the same day). When I got “better” after gaining some independence, I told her that I stopped taking the pills because they made me feel sick. She then freaked out and told me I needed to take them, or I’d get anxious again and “lose everything” that I’d built. I’ve been trying to make myself “well” for years. But I’ve never lost control of my life since I got it.I’m uncomfortable around my mom because she  wants me to get married and have her grandchildren, but I would never want her to influence any child I ever had.But yes. I’m guilty. Bad and ungrateful child. Going to regret having boundaries when she dies. For sure. (Shame about all the time I missed with my dad that I’ll never get back when he dies, but yeah.)I may not be sure how to have a healthy relationship with my mom, but acquiescing to guilt isn’t it, chief. Thanks tho.296 commentssharesavehidereport97% Upvoted
k6jeuj,3.1kPosted by10 months agoArchived[UPDATE] My (M26) German coworker (F29) invited me to a sauna
              
