kqkj9c,15.9kPosted by9 months agoArchived32182018164222UPDATE: I (30F) caught my husband (31M) in an affair and I don’t know how to move forward.
              
            UpdatesOriginal Post: https://www.reddit.com/r/relationships/comments/i7wkqu/i_30f_caught_my_husband_31m_in_an_affair_and_i/First of all, I just want to thank everyone here for the support I received following my first post back in August. At the time, it truly felt like my world was ending. It was important to me to make this update because I need to tell anyone who’s currently going through the same thing—IT GETS BETTER. You will get so much better.I had one conversation with my husband since everything happened—by his choice. It lasted maybe five minutes and was like talking to a robot. I know from others that he cries to people about how he ruined his life, but I have never once gotten an apology or the same show of regret. At this point, I don’t care. I know him and the other woman are still seeing each other and frankly, they deserve each other. Good for them.While I still feel angry occasionally, I no longer mourn what I once had. Instead, I’m so excited for the life I now get to live. I moved to a small walkable city and gave myself my dream apartment. It makes me so happy to see how I’ve decorated it and to just live in a cozy place instead of our old dreary house.  I was the breadwinner in our marriage, and he would make me feel awful about wanting to pay for nice meals or do fun things. Since moving here, I’ve done a ton of foodie fun stuff and don’t feel guilty. It’s so refreshing.I have dipped my toe into the dating pool again and had plenty of mediocre dates from dating apps. Recently, I found someone who I’ve really clicked with and am enjoying how appreciated and desired he’s made me feel.  It’s definitely early and we’re moving slow, but overall, dating has made me realize that I’m a catch who doesn’t have to settle.Therapy has done wonders and I’m so happy I immediately dove into it. My therapist is proud of me. I’m proud of me. I’ve stopped looking at being divorced as a failure. He failed—not me. I’m genuinely happy and excited to wake up each morning and no longer feel like this terrible weight is sitting on my chest. The holidays were surprisingly easy and I found myself so happy to spend time with my family without having to compromise anything.So all in all, life is good and there’s so much of it ahead. Looking back, I can’t believe I wasted so much time thinking about how I could get him to come home. I’ve made my own home and my own happiness and that is worth so so much more.TLDR; Husband left me for another woman. He sucks, but things get better.380 commentssharesavehidereport99% Upvoted
l4wa08,14.5kPosted by9 months agoArchived1918815Update to the pettiest question ever
              
            UpdatesUpdate to this petty thing: https://old.reddit.com/r/relationships/comments/3hi08p/stupidest_question_ever_is_there_any_polite_way/It  took 5 years and a marriage and he curled his eyelashes last week. He found my eyelash curler and asked what it was for and I told him how to test it on himself. He said he didn't notice any difference but his eyes sparkled for the first time.He's not going to keep doing it but at least I know what his pupils look like now lolTL;DR: I didn't ask him, he asked me.248 commentssharesavehidereport98% Upvoted
lxp1ee,11.4kPosted by7 months agoArchived71034UPDATE: Me [36 M] married to my Wife [36 F] 11 years, and I can't stop thinking about a girl I dated for 1 month 16 years ago.
              
            UpdatesOriginal Post https://www.reddit.com/r/relationships/comments/lqpshq/me_36_m_married_to_my_wife_36_f_11_years_and_i/So I mentioned to my wife vaguely that I was having a bit of a midlife crisis and ruminating on my past a bit too much. That I miss how I was physically at my peak in college.She said she is also having a bit of a crisis, worried about longterm health and missing the shape she was in before kids.We made a commitment to each other to get into shape and have changed our eating habits and bought a treadmill. I have been working out daily and my rumination issues have really dwindled. We also planned a nice vacation, and a few get togethers with frends in the next few months.tl;dr: Told wife I was having a crisis without much detail. We are making strides to better ourselves and each other.207 commentssharesavehidereport98% Upvoted
hxzwcl,8.1kPosted by1 year agoArchivedUpdate: My(M26) wife(F26) is not happy
              
            UpdatesOriginal Post: https://www.reddit.com/r/relationships/comments/hm1wdi/mym26_wifef26_isnt_happy/?utm_source=share&utm_medium=ios_app&utm_name=iossmfThank you everyone for the advice from the original post. I just wanted to give the community an update. My wife finally got back yesterday from leaving to go see her sister. We talked for a little bit yesterday, but still came to the same thing she has been telling me. She doesn’t want to be with me because she doesn’t feel in love, emotionally connected, or intimate towards me. She views me as a friend. I told her she needed to choose either we work on this and go to counseling or it’s a divorce and we cut ties. She couldn’t decide and said to give her the weekend.This morning I woke up early, made her breakfast and brought it to her in bed. Then took her out to eat for lunch and desert trying to just spark anything to see if she would agree to work on it. Well we sat down again after getting back and she said she wanted a divorce and she was 100% on that.It was tough. A lot of crying, sadness, hurt, and all the emotions one would feel. I ended up just going to my room and she left for the night. I decided to get out and do something so I jogged and listed to some music for a bit. It helped.I came to the realization that we all have such little time on earth and I don’t want to waste it moping around. I want to improve myself physically, emotionally, and mentally. I want to just enjoy life and find myself again. So I’m going to do that and one day I might meet someone who is perfect to continue the journey of life with me.So I’m still sad and hurt, but all that to say I’m moving forward and trying to be positive. Thank you all for your support.tl;dr Wife wants a divorce. I’m trying to stay positive and move one.421 commentssharesavehidereport99% Upvoted
nhr3yo,8.0kPosted by5 months ago491016UPDATE : I (46F) have hurt my daughter (16F) by giving her friend(16F) a few books
              
            UpdatesOriginal postI found the perspectives and guidance I received really helpful. I decided to just spend some time with her. She loves to bake and we baked together and we had some movie nights. her comments melted away and she became happier.we were baking yesterday when she came out to me. I didn't make a big deal out of as I felt she didn't want me to. I just told her I loved her before continuing to bake as if nothing happened. We did have a conversation later on.She told me that she and her friend had been together ( scary, how well kids can hide things.) Her girlfriend wanted to come out but she didn't and it had strained their relationship. It seems, they had a fight before we gave her the books to her (ex?) girlfriend and that had hurt her. Their relationship is in the limbo and she doesn't want to come out to the world right now. My husband ordered a small pride flag to keep in her room. The world is a bit crazy right now and we want her to have a space where she can be herself.TL;DR : My daughter came out to me, her friend was actually her girlfriend and they had a fight.129 commentssharesavehidereport98% Upvoted
l5jc7c,7.3kPosted by9 months agoArchived8221515UPDATE: My (29M) soon to be ex-husband seems to feel entitled to another chance with me (28F).
              
            UpdatesLink to original post: https://www.reddit.com/r/relationships/comments/gklndb/my_29m_soon_to_be_exhusband_seems_to_feel/?utm_source=share&utm_medium=ios_app&utm_name=iossmfWell, turns out my gut instincts were right. The entire time he was begging for another chance and promising “this time would be different” (eye-roll) he was still sleeping with the affair partner and telling him he loved her and would do anything to make it work with her. It didn’t even hurt me to find it out. I was THAT unsurprised. It just helped me stop feeling guilty. I divorced his ass.I thank the universe every day that he is no longer connected to me in a romantic way. It feels like an ENORMOUS weight has been lifted off my shoulders.Shortly after my original post I met someone by chance at a wedding and fell in love. This person is everything my ex husband was not. The kindness, compassion, and respect they show not just me, but to my daughter as well, is like something from a dream. I never knew love could be so easy.To anyone in a loveless marriage reading this-LEAVE. Do the hard thing- ESPECIALLY if they have a pattern of leaving/returning/cheating, etc. Lord knows I was terrified to cut the cord. At one point in time I was actually starting to feel bad for the guy because he was begging me every single day for another chance. He tried to convince me that getting a divorce would ruin my future, our daughters future, that she would come from a “broken family”- but it was the exact opposite. It was broken already and I fixed it. Once I made up my mind that divorce was the best option, I absolutely thrived. I learned independence. I found how to be happy on my own. I found happiness in a partner. Life has never been so sweet. The bad shit makes the good shit so much better. Thank you, Reddit, for the support on my original post. It helped turn my graveyard into a garden.TL;DR: I divorced him and found true happiness.160 commentssharesavehidereport98% Upvoted
hfwaxf,6.8kPosted by1 year agoArchived3UPDATE to “I'm unhappy with how my (24 F) boyfriend (26M) treats me, but he won't listen to me for long enough for me to get my point across”
              
            UpdatesHere is the original post:https://www.reddit.com/r/relationships/comments/grls25/comment/fs2iubn?context=3Tldr: confronted my bofriend about how he treats me after asking for advice on reddit. He cried and talked about his issues, we broke up. I'm much better for it. Firstly, thank you to everyone who commented on my original post. I got so much from it, and seeing so many supportive comments really helped me. I learned a lot, so thank you all so much. I realised through reading your comments that I was in an emotionally abusive relationship. It wasn't communication tips I needed, I needed to get out. The past month has been so up and down but I wanted to share an update. After a pretty weird “stepping on eggshells” kind of morning, I confronted him about his behaviour and mood swings. I prepped myself for a huge argument and honestly it didn’t go exactly as I expected. First of all he started to deny he was doing anything wrong, but for once I stood my ground. I don’t think he was expecting that. I had lots to say (many of your comments came in useful there), and I tried so hard not to back down. After a while he kind of… changed. He got upset. He then started saying all sorts of things, that he was sorry but he didn’t realise how his behaviour affected me (though I’d brought it up many times). A little later on he said that he had been thinking for a few months that it was his fault my doctor said I had depression. So that’s a huge contradiction?? He said that for a few weeks he had been thinking about breaking up with me “because it’s my fault that you are this way and breaking up sooner would have been the noble thing to do”, but that he was so torn for ages. He said that’s why he had been even more awful to me lately, that his frustrations were just coming out. Again, contradicting what’s he said about not realising how his behaviour affected me. He said he has never cheated but I’m really not sure if I believe that. Maybe it’s best if I don’t know.Then something really unexpected happened, he started to cry, the first time I have ever seen him cry. He told me that he had been texting a work friend over the past few days about our relationship. He even showed me a message she sent to him which went something like this: “you have a wonderful, textbook girlfriend and you are fucking it up because you are being an ass. This is why everyone at work thinks you’re a psychopath. You are so cold and bad when it comes to feelings”. So I guess it wasn’t just me who found his behaviour not normal??He cried even more and said that he doesn’t feel close to people, that there’s only a handful of people he lets in and he doesn’t know why he does that. He said that even being around his immediate family was cold and formal and he doesn’t know why he is like that and can’t connect with people, and that’s also why he throws himself into work so much. I told him that if he didn’t get help, he would end up a very lonely old man. In that moment I felt pretty strong and proud of myself.So as you may have guessed, we broke up. Part of me for a while even thought about trying to save it and work at it, and now that I look back I can’t believe I was ever even thinking that. He kept saying “I just don’t know what to do for the best, should we break up or not?” But doing so was absolutely the right thing. I’ve since had many friends coming forward saying they didn’t trust him, something was off etc.Regarding the girl I talked about, his ex who he cheated on his other ex with- I could see on her brothers Instagram a video of my ex smirking at his phone and the caption was “he’s thinking about my sister ;)” to which he replied with another winky face so… what does that say. But I’m not looking Instagram at this stuff anymore. On the day we broke up he packed some bags and left, he told me to stay with a friend. It turns out that that friend was his exes brother, and he’s been living there for a month. I will be moving into a new place in 2 weeks and even though he has gone to stay with his friend he is still paying his share of the rent, he just swings by to pick up some stuff every now and then when I’m at work, I haven't actually seen him.For the past few months I’ve been feeling really low, with barely any energy. I’m picking myself back up again and though it’s a slow process, I’m coming back into myself. I’m determined that I’m not going to let anyone make me feel like that again.I’m not sure if I needed to write all of that and if you guys needed all of those details, but writing this was quite cathartic. I guess I would just say, to anyone who is reading this and my original post, who is in a relationship that they feel horrible in, just leave. It’s hard, but please leave. You will feel SO much better.Thanks again, Reddit.130 commentssharesavehidereport98% Upvoted
kcx4yw,6.7kPosted by10 months agoArchived28611913[1 Year UPDATE] My girlfriend (F 20) cheated on Me(M 21) with her bestfriend..
              
            UpdatesAn year ago I posted on his subreddit. [Link below]https://www.reddit.com/r/relationships/comments/d78jqe/my_girlfriend_f_20_cheated_on_mem_21_with_her/So I wanted to provide an update and thank my fellow redditors. I took the advice and broke up and realised that the relationship was really sucking the life out of me and was the worst thing in my life at the moment. Since then I have met someone who understands me and cares for me, theres no drama (Well I once ate the last pizza slice and she got pretty angry but yeah thats the level of the drama). We support each other and she makes me a better human all around.Because of my ex i wasn't able to focus on my studies and the breakup combined with the Covid Pandemic gave me ample time for studying and I landed an internship at a big Bulge Bracket company and also Im working on a few personal projects that I love spending time on. The pandemic also gave me time to realise that I was with the wrong person and I love many others who love me be it my family, friends,etc. I feel really liberated.Today I was looking back at what used to be and I remembered that this subreddit for the trigger point for the change in my life. SO THANK YOU AND YOU ALL ARE AWESOME. Its because of you Ive gone from Crying nights to Happy days.Edit 1: Some edits based on comments.Edit 2: HOLY SMOKES! I didnt expect such a reaction. Thanks Guys.Edit 3: Such Wholesome Comments, Thanks Guys.TL;DR! - Took the advice of fellow redditors and broke up with my ex and spent probably the best year of my life.277 commentssharesavehidereport98% Upvoted
hzwqcy,6.2kPosted by1 year agoArchived22I (24m) don't want to come off as weird to my apparent guardian angel (40m)
              
            [new]UPDATE:Thank you so much for all of the advice, and kind words.  You guys are great!  I've been very hesitant to use reddit up until now but you guys have proven my skepticism wrong!  I've decided I most definitely should write a letter for sure explaining how much he has helped me, and how grateful I am.  I think it's probably best to avoid any strange verbiage like "father figure" or "guardian angel" just because I don't want to make myself uncomfortable more than anything.Also!  I think based on a lot of your suggestions it might make me feel good if I got him a gift. Early on in our friendship he and I connected on our mutual love for fishing.  He is an avid spin fisherman, and I love fly-fishing, and actually am very good at it.  He mentioned to me that he'd love to learn to fly fish one day but never has.  Would it be cool if I bought him a nice fly rod and reel, and just added a P.S. to the note that I'll gladly teach him how to fly fish some day?  Or would that be weird?  Let me know!Also also!  Anyone know any good psychiatrists?Thanks for all your feedback, observations, kind words, and advice everyone!!!ORIGINAL POST:Most of my life after high school has been me skipping from job to job, either because of my inability to perform the job, laziness, or just plain rudeness on my part.  This probably all has a lot to do with a lack of a good relationship with my father.  I have struggled, even in childhood, to find anything I'm passionate about.  Often when I try something new I will get really excited about it and then be done with it after a week or two.  This pattern has lead to severe depression, and terrible relationships in most parts of my life.  I have a few friends who are close and supportive, but they are so keenly aware of how untrustworthy I am, just because I change my mind about who I am, and what I believe so often.About a year and a half ago, I went to get my haircut at a barbershop near my house.  I had recently become miserable in my latest endeavor: teaching music.  I had never met the barber, and he had never met me, but he asked me a few questions, and I grudgingly answered.  He stopped cutting my hair, looked me in the eye and said.  "You just need to be a barber."  I laughed, and he reiterated, "No, I'm serious, there's a school right down the street.  You need to be a barber."Flash foward a year and a half.  I've graduated barber school, and I have a job cutting hair.  I've never been more excited or passionate about anything in my life (aside from getting married).  The process of getting to this point has been insanely difficult, but also extraordinarily fulfilling.  I've never felt this way.  It's like no matter how much life sucks, I always have comfort in knowing that I am on a road to becoming a better barber.  To put it simply: this is the first time I've stuck with ANYTHING for more than 8 months, and I feel like I'm just scratching the surface!During every step of the process of becoming a barber, this man has been like a guardian angel.  He not only directed me to the school, but somehow got my tuition rate lowered by speaking with the school owner without my knowledge.  He encouraged me every time I felt unsure or afraid, and let me stand next to him for hours on in at his shop and taught me everything I didn't get to learn at school.  Tricks of the trade, and his special secrets that he's learned over the years.  My wife (I know unbelievable that I'm married given my background right?) was ready to divorce me, and break up with me, but this man AND HIS WIFE counseled us, and helped us make it through the year of barber school.  As the icing on the cake, he secured a job for me, cutting right next to him, at his brothers barbershop.This is just a sampling of the pure graciousness this person has shown me.  Every time I'm around him, I want to express to him how thankful I am, and how I want to make him proud.  It's like he's the father I never had.  But for some reason, I'm afraid that he will be put off if I thank him?  I'm not sure what it is.  I feel like I owe this man everything that I care about.  If it weren't for him I'd be working in Macdonalds, single, and probably suicidal.  (no hate for McDonalds workers, it's just not for me).  I just want to show him that his grace has NOT been taken for granted.  I want to make him proud.  I know this is probably really lame for this sub, but... it's so hard for me to wrap my head around how to repay him, or thank him without coming off as weird.He has a son of his own, and I don't want to make him uncomfortable by making him feel like *I* look at him like a father figure?  I don't know if that's wrong or not.   Any advice is welcome.... please!TL;DRMy guardian angel helped (and is still helping me) get my shit together, and I'm an awkward man baby that feels like I have a new father and want to tell him I immensely appreciate him but don't know how to not seem weird about it?369 commentssharesavehidereport98% Upvoted
ne1neo,6.2kPosted by5 months ago21333[Update] I [29F] am unsure on how to put the moves on my husband [32M]
              
            UpdatesOriginal PostTl;dr of last post: Due to coming off some long term medication, I have a sex drive for the first time in about 10 years. Realized I have no idea how to hit on my husband or initiate in general.My last post didn't get a ton of attention, but I thought I would update people anyways. I took most everyone's advice and talked to my husband. He thought the whole situation was hilarious (in a nice way). But he was very reassuring. I told him about my fears of rejection, or doing something wrong. How my body issues have made it difficult to initiate because I fear I wont be able to turn him on. He gave me some ideas on how I might come on to him, what subtle moves might work to help initiate. He also reassured me that unless something major was going or he was sick, he would pretty much always reciprocate. He soothed my body fears and told me he finds me very attractive and I shouldn't worry about that.You guys, this has been life changing. Talking with my husband completely alleviated my fears. After a couple of false starts, I was able to start initiating. And its been going great. We're both all over each other all the time, just like we were highschoolers again. Maybe even better. Thank you so much everyone for convincing me to just talk to my husband.Tl;dr: Talked to my husband. Things worked out perfectly. It's like were 16 again.123 commentssharesavehidereport98% Upvoted
hqzk0u,6.1kPosted by1 year agoArchivedMy boyfriend's ex wrote a letter to me. I feel really strange and jealous even though it was a nice letter
              
            RelationshipsMy boyfriend (26) was in a relationship with a girl for 3 years from 20 to 23. She's from the other side of the world and missed her home to much so eventually she went back and that's why they broke up.Over the 9 months that I've been with my boyfriend he's told me a few things about her, all postive. From his friends I heard that they were THE dream couple and that she was a very kind and lovely person. Some said that they think he's never going to love again like he loved her which obviously hurt.Well today it got weird. Apparently when they broke up she gave him a letter. Amongst other things it says that she wishes him happiness blah blah. But then it says that he should give another letter to the girl he finds love with again. Apparently she enclosed that letter.He gave it to me unopened. I didn't know what to expect. But she was so nice in her letter. Basically said I'm very lucky to have his love that I should cherish it and that I must be a great person if he's chosen me. Then she included some anecdotal tips on how to make him happy.I just feel weird. This woman seems to be a saint. I don't know how to feel about this letter and the whole thing. Should I contact her? But what would I even say? Isn't it strange that my bf or anyone else hasn't mentioned a single negative thing about her? Somehow this letter made me jealous because I could feel a level of closeness that I don't have with my boyfriend. What should I make of this? ￼ Tldr. Bf gave me a letter his ex wrote to me.843 commentssharesavehidereport98% Upvoted
lq5de8,6.1kPosted by8 months agoArchived42UPDATE My best friend [22F] is giving up a full-ride scholarship to be with her boyfriend of >3 months
              
