kxwn58,974Posted by9 months agoArchivedRecently found out my (28F) husband’s (29M) sister-in-law (29F) is his ex-fiancée.
              
            RelationshipsMy husband and I have been married since July. He was estranged from his dad/half-siblings long before we started dating so I only met them a few months ago. In October, his grandmother broke her hip, so we went to stay with her to help with her care. It got out that we were staying with her and his dad’s family popped in a few times to try and talk to my husband. He got really cold whenever they were around.Eventually, his older half-brother’s wife showed up too and insisted on staying over to “help”. She’s spent every second trying to get my husband’s attention. At first, I thought she was doing it to try and get him to talk to his dad’s side until his grandmother made a comment about how she was a desperate harlot. I asked her about it and she told me about how she used to be engaged to my husband but broke up with him for his half-brother when my husband got disinherited.He was very upfront when we first started dating that he had previously been engaged when he was 22 but refused to explain why they broke up. He just kept insisting their engagement was a mistake.I feel very uncomfortable now around her and I’m not sure what to do. We can’t leave because his grandmother needs the help and I really like her so I wouldn’t want to leave her on her own anyway. I did speak to him and he confirmed his grandmother’s story but thinks I should just ignore her.The thing is… I can’t. All of the sly comments she’s been making since she got here suddenly make a lot more sense. So, what do I do?TL;DR – My husband and I are living with his grandmother after she broke her hip. His SIL has also decided to stay here too to “help” but has spent all of her time trying to get my husband’s attention. I assumed she was trying to get him to reconcile with his family, but his grandmother told me she was his ex-fiancée. My husband wants me to just ignore her but I don’t think I can.167 commentssharesavehidereport98% Upvoted
mh0zpp,974Posted by7 months agoArchivedComments are lockedMy (20F) friend (20F) tried to hook up with my boyfriend (22M) a few weeks ago and he didn't tell me about it
              
            RelationshipsTLDR: My boyfriend didn't tell me about one of my friends hitting on him. He turned her down but i'm still worried about the fact that he didn't tell me.A friend of mine tried to hookup with my boyfriend. He turned her down, but I'm sussed out by the fact that he didnt tell me. I only found out from my boyfriend's friend who was there when it happened. He thought that my boyfriend already told me about it, since it was her who hit on him and he turned her down and there was no reason to hide it.I confronted my boyfriend about it later and he said he didn't want to ruin our friendship and that he told her if she doesn't stop being weird he'll tell me. He says he wanted to give her a shot at saving the friendship.I already decided that I'm done being friends with her because I don't want friends that would do something like that. Besides I've always thought she had a thing for him anyway. She thinks that just because they met first that means she's entitled to him or something. I don't need that kind of bs in my life so if he had told me I would have cut her off immediately which is what I did when I found out.The problem for me right now is that its weird that he didn't tell me about it. I understand that it must have been an awkward spot for him but you'd think he'd want to tell me immediately to avoid a misunderstanding. Besides its weird that he cares more about potentially saving my friendship with her than he does making sure he doesnt come off as a cheater.My friends think he hid it from me because he was interested but I don't think he's that kind of guy. Granted we've only been dating for 4 months, and I still don't know him that well so anything is possible.What do you guys think? is it a red flag that he didn't tell me?92 commentssharesavehidereport98% Upvoted
ljjzwg,932Posted by8 months agoArchivedHow do I [28F] address this awkward text from my friend [32F]?
              
            [new]I have this coworker I've hung out with a handful of times outside of work. We've all been working from home so she has invited me on a few hikes, including one last weekend. Then this weekend, she asked me if I wanted to have a movie night with her.I declined. I usually am one to jump on social invitations and it's rare for me to say no to anything. I'm the friend that you could call at 1am and say "hey, we're about to go do something crazy" and I'd totally be down. But I really just didn't feel up to anything this weekend. I've felt super burnt out lately. I've worked long weeks and our line of work is emotionally taxing. On top of that I do dance and acrobatics classes 4 times a week, so I just don't have a lot of downtime. I was really looking forward to this 3 day weekend to decompress.  Plus I just got the covid vaccine and it's made me tired and headachy. My Valentine's weekend plans were basically to take a hot bath, wear sweats, and watch a lot of Netflix. And I was stoked about that.She accepted my refusal, but texted me a couple times today about work stuff, and called me at one point. I saw it but didn't answer because I was on a Facebook call with my sister. Then she texted right after calling, asking me if I could look something up in our work system because she was out meeting with a client and needed the info. That seemed important so I sent her the info. Then I went back to doing what I was doing. Not really a big deal.But then later she sent me more messages, which I didn't see right away. When I did open them, the first couple were just venting about work, but the next ones were odd. She said, "I'm going to get you to agree to a movie night someday, I swear I'm an awesome friend." Followed by, "I know you are super guarded and don't like most people but I could use a friend now."I haven't responded. I feel awkward because I didn't see them until late at night and several hours after she had sent them, so it seems like I was intentionally ignoring her. I wasn't, I just am notoriously bad at texting. Most of my friends know this and will use facebook to message/call me since I'm in front of my computer way more often than I check my phone. But also, I just wanted one weekend to disconnect and I feel like she has suddenly been kind of aggressive about contacting me when we really aren't that close and don't have a history of talking very frequently at all. Maybe she is going through something? But I wouldn't expect me to be her go-to person for support.I feel guilty for leaving her hanging and I figure I will answer her tomorrow. But I don't know what to say. I have no idea why she described me as "super guarded" and "don't like most people." She hardly knows me and that's not me at all. Sure, at work I try to stay professional and I don't interact with my coworkers as freely as I do my other friends, but I am a pretty easygoing person and back when we were working in the office, my office was the main place where people stopped by for snacks (I kept a bucket of chocolate for anyone who needed it) and to chat. So I really don't feel like I give off "don't like people" vibes.And it felt kind of patronizing, like she was implying that I don't have friends and am in need of her friendship. But I'm not interested in a friendship where someone is trying to "save" or "fix" me. I have had those friendships in the past and they suck. Now I have friends that like me for who I am, which is way better. I'm not interested in being anyone's project.I'm kind of upset about it and not sure how to address it.tldr: coworker/casual friend sent me some awkward texts that I don't know how to respond to.158 commentssharesavehidereport97% Upvoted
hl4bsj,933Posted by1 year agoArchivedMy good friend thinks I 'indulge' my boyfriend's OCD and is angry at me.
              
            [new]My lovely lad has OCD, when things are alright (whatever that means) you'd barely notice apart from him being really into organising and taking a tad bit longer showers. But when stressed it can be nasty - washing hands/doing dishes till there's blood; furiously cleaning instead sleeping; asking about the quality of aformentioned cleaning processes; trying to cook and cleaning in the middle of it etc.He goes to therapy, takes meds and before corona he got a service doggo so there hasn't big any 'bigger' hurdle for at least a year. Even quarantine went fine as we managed to come up with a makeshift routine (which I'm super excited about as it was one of the biggest changes in his lifestyle and even non-OCD folks struggled).We don't live together but when beginning a reconstruction of my flat I decided to do it as much OCD-friendly as possible. We have a lighting system that offers many 'levels' of brighteness, can be alterned to warm or cold. Bathroom is cozy af (if it makes sense, he once told me he didn't want to spend so much time in bathroom because it looked like a bathroom and, therefore, wasn't designed for spending decades in it but then he found himself doing exactly that and when he finally came out he felt horrible because he knew it wasn't normal). I purchased soap/shower gels with more natural ones so it'd not irritate his skin. Also included easy-to-clean-up surfaces and organisers.So far he managed to cook without scrutinizing everything for stains etc. for 2 weeks he stayed at mine. (that makes me happy!!)Onto the problem, my friend Aga who knows about my bf's OCD was one of friends I invited to my 'homewarming' bash. She was the only one who later insisted on having a few words with me regarding my new interior. Her main 'concern' was my flat being too much OCD-friendly. Personally I don't think there's nothing like this as he still has his thoughts and leads a normal, social life which keeps him on his toes. Also I had talk with his therapist and she told me it was worth trying and could be helpful if he was feeling 'supported' in my environment. I shared those thoughts with Aga but she replied with a theory when I should keep him alerted so he would get used to the mess etc. Which I cannot imagine doing, truly, as it would negatively influence our relationship.She refuses to visit my flat as it reminds her of my 'weakness'My family and those who I shared this convo with think I should keep my distance from Aga. But I don't know, she is one my close friends, we have never fought like that and it makes me anxious. I also start to worry if I didn't fuk it up, tho I know I can relate on therapist advice but it pops in my head now and again. So I guess I needed to rant on internet just to get this frustration off my chest.TL;DR I decided to adjust my flat so it'd be more comfortable for my bf who has OCD (after talking with his therapist). One of my close friends told me I was, in fact, supporting his illness and should put some kind of 'shock-treatment'. I don't know how to feel about this.196 commentssharesavehidereport97% Upvoted
kzuu0c,921Posted by9 months agoArchivedI [20F] found out that my best friend and only family member from high school [24F] faked her pregnancies... and literally everything. Six years of family was taken from me in one night. What is the process of getting through this, and possibly helping her mental health?
              
            Personal issuesI feel like I need to get this off my chest but I also kind of need advice for handling it. I really love her and I wouldn't want to leave her. If there's a way I can help her, she really deserves it. She never struck me as the type of person to do something like this or even have mental problems that would bring her to do something like this. Now it's really really messing with me and I'll need help getting through it. Even seeing things about pregnancy or best friends triggers the hell out of me... I can't even go to work and trust people or talk to anyone who we saw at school or look at memes.... I have live with no friends or no one to talk to but now there's no trust. If this counts as a catfish, then I got catfished in real life.She's literally the only family I've had besides for my boyfriend.. We met through a big mix of friends who were at the breakfast and lunch table. I'm a few years younger than her though she was in high school with me for 3 years because she would miss a lot of school and get held back due to her own family problems. Back then 3 years was a long long time, just because I was going through so much, constantly getting kicked out of my moms or dealing with her drunk boyfriend and moved in and out of the foster home because of physical abuse and things like that. She was there through everything. She was my role model, my hero like a mom to me, literally like a god. She would always bring food to school help with my medical problems and give very genuine consider advice. Never judge me for anything no matter how big of a nerd I was. She's literally my big sister. Even after she graduated and moved away, she still supports me online 6 years since we first met. She became my sister, but as lot of times she was actually like my mom and I called her mom and it felt so special and genuine and she would hold me just like you imagine a mom would....The thing was, back in high school about a year after we met, she started talking more and more about a best friend. (I never met this best friend but of course through genuine daily conversation, I just didn't have reason to question his existence. ) He eventually became so important she was talking about dating him and she has a lot of pictures of them, and he and I would talk online in a meme group with her and other people at school. Cool enough. I never went anywhere and this is a really big city with many schools, and she was popular with so many people, so I really didn't question anything as long as she was happy and safe. Eventually that conversation gradually turned into them being in love. I was happy for them but a shit ton of stuff was happening for me and I was going through a lot with my mom's boyfriend. Her support still came in and both of them would send me money and things, so he became like family to me too. She helped me through my first sexual experiences, a pregnancy scare, my mom's boyfriend's abuse, me losing my little brother, everything. He was also by my side. When my boyfriend hit me and blackmailed me and I got suicidal, she was EVERYTHING, she'd come over at 3 in the morning if I needed it.Her senior year came along. She was definitely going to be graduating that year and she also had some plans for college. I was a junior and I was kind of sad but I was already coming to terms with the senior thing and I knew she would still have my back. I knew her boyfriend would have my back too, especially when she revealed that he proposed to her and they were engaged. This was my first positive exposure to marriage with science for all my fantasies, so I can't explain how excited I was for them. January rolled around and before Christmas break ended, she stopped by to bring me some presents, and told me something that made me super super super happy-- she was almost a month pregnant! Everyone at school eventually knew about this within the first few months and she was so proud about it, of course I have no reason to doubt it. She would tell me all about her pregnancy and all this cool stuff about her life, both of us ended up making some new friends, and whenever her boyfriend was working a lot shall I would have movie nights and things like that. As her belly grew, we would go baby shopping like sisters and eventually I forced her to let me buy her some baby clothes as a present using one of my compensation checks. Same with food, eventually she caved in. She was now out of contact with her family and starting a new one and she was getting her life completely on and all she had to do was graduate, I was very very proud of her. She had all these amazing ultrasounds and it was all so beautiful, she gained a little weight but carried it very well. She caved in and eventually let our mutual friend give her massages and feed her and everything.Graduation came. She was six months along. She got me my support kitty, who I still have and live to death and even named after an inside joke. For whatever reason, she ended up not attending graduation. No big deal even though it was a lot of money and time spent planning for me to get myself and a few other friends there. I knew she'd graduated and I just assumed she wasn't feeling well. But not only did she disappear from graduation, she basically fell off the face of the Earth physically. I never saw her anywhere around or her to literally anything about her from anyone else, even though she never change her City on Facebook which she's very active on and even listed online jobs. Her only existence was on my screen and she would answer maybe a few times a week, sometimes every day, sometimes not at all. Though she always tells me that she loves me and she is very very supportive and I always have what I need. Eventually in the Summer she did have her baby and nobody even knew about it until she posted online, which I understand because she's had a lot of problems with her family and did have problems with a few people at school. She can have stopped posting on Facebook for a while, posting maybe once a month and stopped using her other social media. She's only had maybe five pictures of her baby, even in private messaging.About a year-and-a-half later, the fall after I graduated, life really wasn't going well for me. The only thing I had to look forward to was her revealing that she was pregnant again! She just found out that she was almost 3 months and everything was going very well for her. Needless to say, no post on Facebook, the birth of this baby was the same exact same as last time. Since this one was a girl in fact, she would be named after me! The middle name would be the nickname that she gave me and I practically graduated my role as her baby girl  and let it go to a second child who I knew would have an amazing parent.They started coming in regular contact with me almost everyday since their kids were one and two and she was a stay-at-home mom. Constant support, constant good advice and comfort, 3 a.m. phone calls whenever I need it, food whenever I need it even though it's sparingly, her giving me a ride to work when I need it. Now that I look back on it, should have two babies sleeping in the car with blankets over the seats, and of course I would listen like a small bean and I wouldn't have any reason to doubt her or make her parenting difficult.All that being said, am I allowed to see the babies when awake? No. None of our friends are. There's always some kind of excuse despite her being a stay-at-home mom. Do you know why? Tuesday evening, I was on Facebook. I commented asking for another picture and talking about how cute they were and everything. I noticed all her boyfriends old comments, which would be him answering other people's questions on her behalf, we're all deleted. Because his account didn't exist. Deleted account Maybe? Now that I think about it, probably suspended because it's fake with no way to verify it. I was asking people have to get in contact with them and they had literally no way to contact. I want as far to message someone who worked in the same place he was talking about working at, and they had no idea who it was. Nobody who works there at the idea who he was and so did nobody at the school he went to. Just amazing.The pictures also had comments from her cousin, who is extremely blunt because she is special needs and obviously doesn't know about this whole sham. Comments were saying things like "There's the cutie dolly! She finally came! Etc" normal for her, and then one stood out --- "did you see those baby's that are like the baby alive they eat and make sounds but there for adults and I know your just the avid collector so are we expecting one of those next month??? :)" .... Yeah, that didn't sound right to me, at all.I looked through more and finally noticed what once felt a little off. They have the same positions each time or have pictures that hide their hands/etc, all pictures of them sleeping, which adds up to more suspicion. I went back to the post with the cousin's comment, and it was deleted, but not before someone else from school could comment asking wtf.I went ahead and messaged her grandma, who had made a Facebook a while back ago, and was the only family she mentioned in a positive light. Turns out, she's living with her grandma, lost her job (because of her boss committing a felony and assault), has no money for school except for the college classes she did, has gotten in trouble for harassment and sexual misconduct, just living a shitty life in an efficiency with nobody except me and two friends she keeps in touch with, and being a mom to her baby dolls. I asked about boyfriend and grandma wouldn't say much but she did relay that there was a guy by the same name she used to have a lot issues with who she currently stalks and hacks..... His current girlfriend told me that he's told her about him being sexually harassed by and lied about. But girlfriend is also a huge drama queen, by the impression I used to get from her.I have never felt so low myself, let alone knowing my only family member who helped through EVERYTHING imaginable is now and has always been lower than anyone I know...Everything was taken from me last night. My family and the person I trusted most, the only person I trusted in my entire life. I don't even know what's real and what's not and I keep looking back at everything that wasn't and there's no cutoff to it.... She is obviously sick but I don't know what to do for myself or for her.Tl;dr: she was my best friend and the only one I could ever trust, going through sex and abuse and grief. Her boyfriend and her became like family in my darkest hour, and Tuesday it all had been ripped from me. Her babies and her entire life are fake as fuck, she's went out of her way to deceive me and everyone, and her boyfriend was probably her catfishing me (based on a boy she may have harassed and now stalks to the extreme). After all she's done for me to keep me physically safe and taken care of as well as emotionally supported, I am now deeply concerned and she deserves any help I can give her. I don't know how to help. I don't know how to move on for myself. Even seeing things about pregnancy or best friends triggers the hell out of me... I can't even go to work or talk to anyone who we saw at school or look at memes....54 commentssharesavehidereport94% Upvoted
mdmfet,936Posted by7 months agoArchivedComments are lockedMy Best Friend Is In Love With My Boyfriend
              
            Personal issuesI don’t know how to use Reddit. My boyfriend taught me so everything I know is from him and he recommended I get into the community so here I am.I (m22) live with my boyfriend (m22) and am friends with this guy (also m22 lol). I’ve been friends with him for around three years (when I started college) I met him and we clicked instantly. I introduced him to my boyfriend who wasn’t my boyfriend at the time but was a close friend of mine from high school.Friend (let’s call him Harry. not his name but yeah) so Harry had this boyfriend since I met him but they broke up a while ago like in December or January I think. I’m not really sure. Harry has always been the flirty type. That’s his personality. He doesn’t flirt with me but he’s flirted with my bf before and I have told him to stop a handful of times.It all came to a head a few days/a week or two  ago. My bf told me that Harry had come over and admitted his love for him. I was shocked but deep down not surprised. I’ve seen the way he looks at him and have gotten jealous before I’m just not one to talk about that’s kind of stuff. Also I trust my bf and plan on being with him for the future and stuff. (Bf rejected him really quickly btw. Hi if you’re reading this love haha)I call my friend and get really upset and it turns into a yelling match where he’s telling me He can’t control his feelings. I feel kind of bad for him. A few days later and here I am now. I feel like shit. I don’t have many friends cause I’m extremely introverted and have already been dealing with depression and stuff and just recently started seeing a therapist by my bfs recommendations (he Sees one).I miss Harry. He was my best friend. An I hate not having any close friends other than my bf since I don’t want to lay everything on him.I’m asking what to do in this situation. Should I reach out to Harry and try to reconcile or at least meet up with him to have a talk with the three of us together? I feel like we could reach a mutual understanding. My bf is iffy about it but he wants to do what I want. But I’m not sure what I want.TLDR: my best friend admitted his love to my bf. I got in a fight with the friend and now miss him since I don’t have many people to talk to. Should I reconcile with him?53 commentssharesavehidereport98% Upvoted
nw4gtj,929Posted by4 months ago[24F] How to stop thinking about my boyfriend [25M] with another girl
              
